,character,credit_id,poster_path,id,video,vote_count,adult,backdrop_path,genre_ids,original_language,original_title,popularity,title,vote_average,overview,release_date
53,Walt Disney,52fe4a9c9251416c750e8175,/ksDa3XtV3v07jhQLUgARRi5cFBO.jpg,140823,False,2508,False,/pbTyzFmqah1uQJTig17NiOeCU2d.jpg,"[35, 18, 36]",en,Saving Mr. Banks,12.508,Saving Mr. Banks,7.4,Author P.L. Travers travels from London to Hollywood as Walt Disney Pictures adapts her novel Mary Poppins for the big screen.,2013-11-16
54,Woody (voice),52fe4b68c3a368484e18793f,/ozoGeGfkxLPe8dQWOdLtyLPGQt7.jpg,130925,True,263,False,/4boXb1lsPnC4mvMYG9CkhaQBltq.jpg,"[16, 35, 14, 10751]",en,Partysaurus Rex,10.197,Partysaurus Rex,7.2,"When Rex finds himself left behind in the bathroom, he puts his limbs to use by getting a bath going for a bunch of new toy friends.",2012-09-14
55,Himself,52fe4d33c3a36847f8254265,/1F0bQ77FBIEk0PbS3vV8mbLgZSj.jpg,173458,False,6,False,,[99],en,Stephen King: Shining in the Dark,2.851,Stephen King: Shining in the Dark,6.4,A documentary looking at the life and work of Stephen King.,1999-09-09
56,Eamon Bailey,55528c9bc3a368426f0054e9,/bQVqd5rWrx5GbXhJNuvKy4Viz6j.jpg,339988,False,3375,False,/hENBbG0J4zf4fFB3OVAC50poojR.jpg,"[18, 878, 53]",en,The Circle,23.739,The Circle,5.5,"A young tech worker takes a job at a powerful Internet corporation, quickly rises up the company's ranks, and soon finds herself in a perilous situation concerning privacy, surveillance and freedom. She comes to learn that her decisions and actions will determine the future of humanity.",2017-04-27
57,Narrator,567d70c59251412e52004ea2,/cOisFeyE0FGwsjy1XKLAn7RxukD.jpg,374164,False,0,False,,"[12, 99, 18]",en,Boatlift,1.544,Boatlift,0.0,"From the midst of 9/11, one of the darkest moments in American history, comes this inspiring and relatively unknown story. When the twin towers fell, hundreds of thousands of people ran to the water's edge. They soon realized that Manhattan is, indeed, an island. And that they were trapped. Within moments, an armada of every vessel that could get to the city's seawall spontaneously organized. Dashing into the teeth of danger, hundreds of boats pulled together and, without any formal planning, military or otherwise, they pulled off an ad-hoc sea evacuation that became the largest in history. Their story of courage and resolve reminds us of the powerful spirit that rose among us, on that fateful day. Narrated by Tom Hanks. Directed by Eddie Rosenstein.",2011-09-08
58,The Man,569520fa9251417422000484,,377229,False,0,False,,"[18, 14]",en,The Ocean at the End of the Lane,1.464,The Ocean at the End of the Lane,0.0,"A man attending a funeral in his hometown comes face-to-face with his past when he is confronted with memories of mistrust, adultery, abuse, and a fantastical journey that couldn't possibly be real. It couldn't possibly be real, but the memory of a mysterious girl named Lettie Hempstock ties each bizarre childhood occurrence to the last.",
59,Cleveland Carr (voice),582af4d9c3a368360f0448cc,/nFH5AylexDc47BhE0gmxLVkdpD1.jpg,426128,False,3,False,/lFpMaMdd0RZOlUO05WOPUsYpjhm.jpg,"[28, 16, 80, 18, 878, 10749]",en,Electric City,0.984,Electric City,6.3,"A view of the future of civilization, presented through the lens of provocative themes such as energy consumption, freedom of information, crime and punishment.",2012-07-17
60,Himself,57d0d14492514173ac00573b,/8tdOPx8TZ6y85BHD0G3sS8anuMY.jpg,414792,False,21,False,/j1z8S3ZfgDn47AegrQoslsdAoHl.jpg,[99],en,California Typewriter,5.968,California Typewriter,7.0,"A story about people whose lives are connected by typewriters. A meditation on creativity and technology featuring Tom Hanks, John Mayer, Sam Shepard, David McCullough and others.",2017-08-18
61,Ben Bradlee,58c43116c3a368536200010d,/h4XG3g6uMMPIBPjAoQhC2QIMdkl.jpg,446354,False,3338,False,/8sb4aBST28vN3rBz704XJczS0Ld.jpg,"[18, 36]",en,The Post,18.771,The Post,7.0,A cover-up that spanned four U.S. Presidents pushed the country's first female newspaper publisher and a hard-driving editor to join an unprecedented battle between journalist and government. Inspired by true events.,2017-01-19
62,,58f29f27c3a36807df00433f,,295370,True,8,False,,[99],en,The True Story of Charlie Wilson's War,4.033,The True Story of Charlie Wilson's War,6.3,"A playboy congressman, an outcast CIA operative, and a socialite steer over $300 million of the United States Government’s money — in an era when Reagan couldn’t raise $19 million for the Contras — to fund a covert war intended to turn Afghanistan into “Russia’s Vietnam.”  Is this a joke? Is this some improbable work of fiction? Who are these wildly eccentric figures? How did they pull it off?  In this special presentation from THE HISTORY CHANNEL® discover the intricate details of this incredible, fascinating and completely true series of events. Learn how Texas Congressman Charlie Wilson allied with CIA agent Gust Avrakotos and Houston philanthropist Joanne Herring to secretly bankroll the Afghan Mujahideen’s resistance to the Soviet Union. Retrace the behind-the-scenes machinations that led to the CIA’s largest and most successful campaign ever. And understand the wide-ranging and long-lasting implications of this little-known episode.",2007-06-12
63,Himself / Paul Edgecomb,5910d53ec3a36864ec033b16,,456703,True,0,False,,"[99, 18]",en,Walking the Mile: The Making of The Green Mile,3.063,Walking the Mile: The Making of The Green Mile,0.0,"Frank Darabont explains how this new project was introduced thru a phone call from Stephen King as ""another prison tale"" if he was interested to make it, the answer was not, King expose his concept idea in few words, however Frank asking to Stephen send the script to him firstly, when the first tale was finished and sent to Darabont, after reading such odd story, asking for more, so King replied ""You must wait as anybody else"", receiving later all other tales Frank wrote a screenplay on 8 weeks, so come up ""the Green Mile""",2000-06-13
64,Himself,595d127a9251415a400439f8,/rOaeh83eylKNBkPxUMAUAogb7rS.jpg,464729,False,8,False,/oIgUXB3136p8Y1gf1jqmPdjAFOF.jpg,[99],en,The Story Behind 'Toy Story',5.449,The Story Behind 'Toy Story',8.8,"The documentary short of Toy Story of why and how the feature length blockbuster sleeper movie became a success and helps to boost Pixar's popularity of making one of the few animation movie production companies in the world today, especially in North America.",1996-12-18
65,David S. Pumpkins,59ce6a1fc3a3686aa9019e54,/3uoVw6eGWi3ek9c0DYP4r0O6AkX.jpg,478639,False,14,False,,"[16, 35, 10770]",en,The David S. Pumpkins Halloween Special,4.416,The David S. Pumpkins Halloween Special,4.9,"Set in a small suburban town on All Hallows' Eve, the special centers on David Pumpkins and his skeleton sidekicks who show a young boy and his sister the true meaning of Halloween, answering none of their questions along the way.",2017-10-28
66,,5a1c161cc3a3680b8a0533af,/rc9ovrusS56WpuR79BaYksmEEhq.jpg,224355,False,0,False,,[99],en,"Rebels of Oakland: The A's, The Raiders, The '70s",0.6,"Rebels of Oakland: The A's, The Raiders, The '70s",0.0,"""As soon as you hear the title to this new one, you know exactly what it's about and why it's likely to be good, especially if you were a sports fan growing up in the 1970s. Even to good boys all the way across the country in New Hampshire, the authority-flouting baseball A's and football Raiders were magical. Not only did they win championships, they did it amid clubhouse brawls, feuds with an owner and a general embrace of the 1960s aesthetic.  Filmmakers Rick Bernstein and Ross Greenburg tell the stories of these turbulent, talented teams and show how they perfectly fit their city. Oakland was blue collar and home to hardcore hard-core 1960s rebellion, exemplified by the Black Panthers. Oakland, especially, was not San Francisco, the effete, world-class city across the bay.""",2003-12-10
67,Himself - Narrator,5a7221b10e0a265af50108c5,/rKMq3evH30gc0hrGZFRgeKROu8L.jpg,502139,False,3,False,,[],en,A Timeless Call,0.961,A Timeless Call,5.7,U.S. Veteran tribute made for the 2008 Democratic convention.,2008-08-07
68,Finch,5aecfbc99251411d1e0022e1,,522402,False,0,False,,"[18, 878]",en,BIOS,8.071,BIOS,0.0,"On a post-apocalyptic Earth, a robot, built to protect the life of his dying creator's beloved dog, learns about life, love, friendship, and what it means to be human.",2021-04-16
69,Himself,5c0e5c92c3a36825150c845b,/fp3mOjFJ55HhHVULBMs5oqtzWk2.jpg,567649,False,0,False,/mU7A8sM6TFC5MuFxl2i0rLbEHLk.jpg,[99],en,The Last Mile,0.6,The Last Mile,0.0,"It's been 25 years since “Philadelphia” premiered, and since then, we've come a long way in the fight to end AIDS. In partnership with Coca Cola and RED, ""The Last Mile"" explores how far we've come.",2018-12-01
70,Captain Jefferson Kyle Kidd,5c5f525ac3a3683cc68eab43,/v9gOSS3cQvUel5MJW6qzGF6eQLh.jpg,581032,False,0,False,/ugoims6PfRgcAcIgTRoK2uvjhOu.jpg,"[18, 37]",en,News of the World,18.565,News of the World,0.0,"A Texan traveling across the wild West bringing the news of the world to local townspeople, agrees to help rescue a young girl who was kidnapped.",2020-12-25
71,Colonel Tom Parker,5d2897a8a294f0000f2913d3,/85Jh7gotsavvgKrtV6jOCFGapaL.jpg,614934,False,0,False,/u1OYrMwONCBp0Au6qETRxx4Xd2I.jpg,"[18, 10402]",en,Elvis,7.875,Elvis,0.0,"A biopic about Elvis Presley, with focus on his early years.",2021-11-05
72,Major Matt Mason,5d9ea80ff0647c003fcda073,,638302,False,0,False,,"[28, 12, 10751]",en,Major Matt Mason,0.626,Major Matt Mason,0.0,Plot unknown. Based on a Mattel action figure.,
73,Himself,52fe4b0ac3a368484e17484d,,127850,False,2,False,,[99],en,Inventing David Geffen,2.595,Inventing David Geffen,6.5,"Notoriously press and camera-shy, David Geffen reveals himself for the first time in this unflinching portrait of a complex and compelling man. His far-reaching influence - as an agent and manager, record industry mogul, Hollywood and Broadway producer, and billionaire philanthropist - has helped shape American popular culture for the past four decades. This documentary offers a rare insight into the world of the man responsible for launching the early successes of Joni Mitchell, Tom Cruise, and Guns N’ Roses; co-founded DreamWorks; produced Cats and Dreamgirls;  and is one of the largest contributors to the fight against AIDS. (SBS AU)  Geffen narrates his unorthodox rise from working class Brooklyn boy to billionaire entertainment power broker in extensive interviews.  American Masters explores the highs and the lows in Geffen’s professional and personal life through more than 50 new interviews with his friends, colleagues and clients, as well as other media luminaries. (PBS)",2012-11-19
74,Woody (Voice),52fe4dbec3a368484e1fac11,/aNDrMDZYmcoMlJa6K3VicYeAgt1.jpg,213121,False,551,False,/chICYTbG39OUQHVoHP11ehIoXV7.jpg,"[12, 16, 35, 14, 10751, 10770]",en,Toy Story of Terror!,1.215,Toy Story of Terror!,7.2,"What starts out as a fun road trip for the Toy Story gang takes an unexpected turn for the worse when the trip detours to a roadside motel. After one of the toys goes missing, the others find themselves caught up in a mysterious sequence of events that must be solved before they all suffer the same fate in this Toy Story of Terror.",2013-10-16
75,Himself,52fe4e69c3a36847f828ea91,/dfjLE1HjdR9XhEpN04elCGUOJfA.jpg,237353,False,13,False,,[99],en,Through the Eyes of Forrest Gump,4.53,Through the Eyes of Forrest Gump,8.5,"A look behind the scenes of Robert Zemeckis' 1994 Oscar-winning film, 'Forrest Gump'.",1994-10-01
76,Woody (voice),543d70930e0a266f8400032c,/jqQPN3X3aV5VmpTiEEASt36nlfi.jpg,256835,False,636,False,/k5O30sO1eP0gZkD4qj7BNKIww6q.jpg,"[16, 10751, 10770, 12, 35, 14]",en,Toy Story That Time Forgot,21.568,Toy Story That Time Forgot,7.0,"During a post-Christmas play date, the gang find themselves in uncharted territory when the coolest set of action figures ever turn out to be dangerously delusional. It's all up to Trixie, the triceratops, if the gang hopes to return to Bonnie's room in this Toy Story That Time Forgot.",2014-12-02
77,,56f49b3e9251417a490009da,/oCQUxbAcANmQoCR5TeVDEMdVhWR.jpg,356325,False,17,False,/8bwpkNqLxSk6jDmTATgG4Ruibhu.jpg,[99],en,Everything Is Copy,5.926,Everything Is Copy,7.8,"Jacob Bernstein's extremely entertaining film is a tribute to his mother Nora Ephron: Hollywood-raised daughter of screenwriters who grew up to be an ace reporter turned piercingly funny essayist turned novelist/screenwriter/playwright/director. Ephron comes vibrantly alive onscreen via her words; the memories of her sisters, colleagues, former spouses, and many friends; scenes from her movies; and, above all, her own inimitable presence. Watch any given moment of Ephron being her sparkling but caustically witty self (for instance, this response to a scolding talk show host—""You have a soft spot for Julie Nixon, don't you. See, I don't..."") and you find it hard to believe that she’s been gone from our midst for three years. Everything Is Copy (Ephron's motto, inherited from her mother) is a lovingly drawn but frank portrait and, incidentally, a vivid snapshot of an earlier, livelier, bitchier, and funnier moment in New York culture.",2015-09-29
78,Himself,57ab202fc3a36827b4001039,,406122,False,9,False,,[99],en,Toy Story at 20: To Infinity and Beyond,1.943,Toy Story at 20: To Infinity and Beyond,8.1,Retrospective looking at the revolutionary computer-animated feature film Toy Story.,2015-12-10
79,Waitstill Sharp (voice),57bbc639c3a368301300088e,/bJWOq7BV5oc1ixSBSdlofUq2ORv.jpg,252451,False,10,False,/ywlUbm7a0M6y8WblU4Asrz3M0QF.jpg,[99],en,Defying the Nazis: The Sharps' War,5.705,Defying the Nazis: The Sharps' War,6.9,"Join an American couple’s courageous mission in 1939 to help refugees escape Nazi-occupied Europe. Over the course of two years, the pair will risk their lives so that hundreds can live in freedom.",2016-09-20
80,Self,5bac137f92514150ee029a76,/yYtY9CRLyz4dXqTOiimdMF7Nt4e.jpg,504561,False,59,False,/8McBKWoQOQZfeIGQl23g0TJ6jto.jpg,[99],en,Quincy,9.35,Quincy,7.4,"An intimate look into the life of icon Quincy Jones. A unique force in music and popular culture for 70 years, Jones has transcended racial and cultural boundaries; his story is inextricably woven into the fabric of America.",2018-09-21
81,Self,5c732730c3a3685a44177f59,/jNTueLKnIavVd1hUNO2c55wnWfF.jpg,325450,False,0,False,,"[99, 10402]",en,The Dave Clark Five and Beyond: Glad All Over,0.627,The Dave Clark Five and Beyond: Glad All Over,0.0,"The Dave Clark Five started the rock n roll British invasion that changed the world, having already knocked The Beatles out of the #1 position in the UK. Watch newly-filmed interviews with Tom Hanks, Paul McCartney, Elton John, Bruce Springsteen, Stevie Wonder, Dionne Warwick and many more, as they share their memories of how the music of the 60s and the cultural revolution of 1964 changed their lives forever. Bonus disc includes 2 hours of extra interview scenes and rare archival footage, including never-before-seen star performances and alternate performances from The DC5 ! Featuring 4 hours of star-studded performances in total!",2014-05-13
82,,5cf19b4d92514138ccb9316b,/1ZpGQVdSec6cCArfFjDXRXn2se9.jpg,606078,False,0,False,,[99],en,People Like Us: Making 'Philadelphia',0.842,People Like Us: Making 'Philadelphia',0.0,"10 years after the release of ""Philadelphia"", director Jonathan Demme, Tom Hanks, Denzel Washington and others discuss about the making of that film and it's important legacy through the years of being the first mainstream Hollywood film about dealing with the topic of Aids, revealing its impact on culture and society. Cast and crew talk about the inception of the project, the making of it and curious stories about one of the greatest hits of 1993.",2004-07-19
83,Himself,5eb53c4a0cb3350021c9af16,,181007,False,1,False,,[99],en,Making Saving Private Ryan,1.4,Making Saving Private Ryan,6.0,Documentary about the filming and production of the 1998 WWII film 'Saving Private Ryan',2004-05-25
84,Himself,5f28ee8eb1f68d00376d1e11,/duInEKeZfJl0rhj24RXjGz3SUB4.jpg,729031,False,0,False,,[99],de,Die Clint Eastwood Story,1.477,Die Clint Eastwood Story,0.0,German Documentary on Clint Eastwood,2018-02-07
85,Mr. Gable,52fe46bf9251416c75082477,/vHGTog9BcjVVYvczJKH36PvAKaE.jpg,16279,False,152,False,/bzjGojNGoLuGvbaeEbjI8BFhJ1f.jpg,[35],en,The Great Buck Howard,11.234,The Great Buck Howard,6.0,When a law school dropout answers an advertisement to be a personal assistant he unknowingly signs on to work for a belligerent has-been magician struggling to resurrect his career. This leads to a journey across the country staging the comeback of a lifetime.,2008-01-18
86,Narrator,52fe48f5c3a36847f81822a1,,56235,False,5,False,,[99],en,Return with Honor,1.703,Return with Honor,5.6,The story of U.S. fighter pilots shot down over North Vietnam who became POWs for up to 8 and a half years.,1999-06-11
87,,56b2431392514103380004b3,/wOMSIJeIt3LunhwSeSF7LO2JuPe.jpg,380994,False,7,False,,[99],en,Mike Nichols: An American Master,2.86,Mike Nichols: An American Master,6.4,"With charm and wit, Nichols discusses his life and 50-year career as a performer and director.",2016-01-29
88,Himself (archive footage),58569e5092514146c903cdbc,/mQzWz5HTyPLcRdGElqhn99kMSQU.jpg,43714,False,5,False,,"[99, 878]",en,The Harryhausen Chronicles,5.185,The Harryhausen Chronicles,6.4,"As an actor, director and producer, Ray Harryhausen has been a vibrant figure in Hollywood, working on everything from family films to mind-bending sci-fi. But his true genius lay in the creation of special effects for movies such as Mighty Joe Young and It Came from Outer Space. Narrated by Leonard Nimoy and featuring appearances by George Lucas and Ray Bradbury, this film documents Harryhausen's remarkable life's work.(copied from Netflix)",1998-01-27
89,Will Mayo,5bab96dbc3a3683ac902692b,/zojyFTrXTdULii1Jh5yHmG0ZTHq.jpg,550600,False,4,False,,[99],en,"The Mayo Clinic, Faith, Hope and Science",4.469,"The Mayo Clinic, Faith, Hope and Science",8.3,"The Mayo Clinic: Faith - Hope - Science tells the story of a unique medical institution that has been called a ""Medical Mecca,"" the ""Supreme Court of Medicine,"" and the ""place for hope where there is no hope."" The Mayo Clinic began in 1883 as an unlikely partnership between the Sisters of Saint Francis and a country doctor named William Worrall Mayo after a devastating tornado in rural Minnesota. Since then, it has grown into an organization that treats more than a million patients a year from all 50 states and 150 countries. Dr. Mayo had a simple philosophy he imparted to his sons Will and Charlie: ""the needs of the patient come first."" They wouldn't treat diseases...they would treat people. In a world where healthcare delivery is typically fragmented among individual specialties, the Mayo Clinic practices a multi-specialty, team-based approach that has, from its beginnings, created a culture that thrives on collaboration.",2018-09-25
90,Self,5ed7ae5e528b2e002073624e,/c1HiJwCJy8OMdrJCmzSD8Wiz89c.jpg,712062,True,0,False,/6rmc43jaxcztIGEeAq2zBIQGQ8L.jpg,[35],en,Pennis from Heaven,0.688,Pennis from Heaven,0.0,"Wherever he goes, Dennis Pennis (Paul Kaye) leaves a trail of embarrassment in his wake. From London to the Venice Film Festival and on to Hollywood, no-one is spared, no star is too big to escape verbal abuse. Victims include Steve Martin, Pierce Brosnan, Don Johnson, Jim Carrey, Richard Gere, Sharon Stone, Sandra Bullock, Charlie Sheen, Cindy Crawford, Demi Moore and Arnold Schwarzennegger. If you're a star, beware! Pennis is out to get you. This release includes previously released Very Important Pennis, Anyone For Pennis? and RIP - Too Rude to Live.",2005-03-28
91,Mailbox-Elvis,52fe465e9251416c9105233d,/ekTcDu7Ahs76IJsqV7ri2nvmyVu.jpg,37641,False,29,False,/m8fwUVdH2TbSkW5eWz9UgrTyOrC.jpg,[35],en,Elvis Has Left the Building,5.899,Elvis Has Left the Building,5.3,"Harmony had an encounter early in life with the young Elvis, and can't seem to shake his influence. Now a Pink Lady selling cosmetics, she seems to inadvertently bring harm to any Elvis impersonators she encounters. After a bizarre car accident leaves a slew of them dead, Harmony goes on the run from the authorities, hooking up with a downtrodden ad exec who has Elvis troubles of his own.",2004-08-27
92,Self,59dc100e92514124cd068260,/2AAvIR2PHoxNITgLDOkXXlWLlua.jpg,467062,False,168,False,/hoML3xQNqd6aRcUXiVlPhrSIfAR.jpg,"[99, 10770]",en,Spielberg,15.447,Spielberg,7.5,"A documentary on the life and career of one of the most influential film directors of all time, Steven Spielberg.",2017-10-05
93,Himself,59e392fc9251410b670003bc,/wQXvOy2hpfLscTorrzhy2icveVZ.jpg,459682,False,7,False,,[99],en,Catch Me If You Can: Behind the Camera,2.01,Catch Me If You Can: Behind the Camera,8.9,A behind the scenes look at the making of Stephen Spielberg's Catch Me If You Can.,2003-05-06
94,Himself (archive footage),5b6be82092514140641214e4,/QmEOPgTZ9hELnWSmfzelaqAriU.jpg,471198,False,1,False,,[99],en,The Universal Story,0.991,The Universal Story,7.0,"Richard Dreyfuss hosts a celebration of the 80 year history of Universal Studios. Founded as IMP by Carl Leammle to oppose Edison's Motion Picture Tust, it soon grew under the leadership of 21 year old production head Irving Thalberg with classic silents from artists like John Ford, Erich Von Stroheim, and Lon Chaney and prospered further in the Sound Era under the leadership of Carl Leammle Jr. with such classics as ""All Quiet on The Western Front,"" ""Showboat,"" and the studio's signature monster franchises, ""Frankenstein"" and ""Dracula.""",1996-04-21
95,Himself,52fe4ab79251416c750eb843,,141498,False,1,False,,[99],en,Lost Moon: The Triumph of Apollo 13,2.857,Lost Moon: The Triumph of Apollo 13,6.0,"This is a truly terrific piece of work. The program involves Ron Howard, Jim Lovell, Marilyn Lovell, producer Brian Grazer, executive producer Todd Hallowell, visual effects supervisor Robert Legato, lead digital compositor Mark Forker, astronauts Fred Haise, Dave Scott, Apollo 13 flight director Gerald Griffin, command module systems controller Sy Lieberglot, Apollo 13 flight dynamics officer Jerry Bostick, mission control director Gene Krantz, Tom Kelly of Grumman, NASA mission operations director Christopher Kraft, daughters Susan Lovell Williams and Margaret Haise, command systems module controller John Aaron, and actors Tom Hanks, Bill Paxton, Kevin Bacon, Gary Sinise, Kathleen Quinlan, and Ed Harris. The show offers a mix of film clips, interview segments and archival footage from the era itself to create a very informative and enjoyable documentary.",1996-01-01
96,Himself,543ae4340e0a2649ab00378c,/vhK51wJybwZTRCPVUOkGpSI4auN.jpg,15302,False,143,False,/jbdvzJvNu0swWURJp71Fxwd54Fm.jpg,[99],en,The Pixar Story,10.785,The Pixar Story,7.5,"A look at the first years of Pixar Animation Studios - from the success of ""Toy Story"" and Pixar's promotion of talented people, to the building of its East Bay campus, the company's relationship with Disney, and its remarkable initial string of eight hits. The contributions of John Lasseter, Ed Catmull and Steve Jobs are profiled. The decline of two-dimensional animation is chronicled as three-dimensional animation rises. Hard work and creativity seem to share the screen in equal proportions.",2007-08-28
97,Mr. Macauley,547200b79251411752000075,/oCyNJbfZ7kQVhRyOlNcJhlsizLb.jpg,305642,False,67,False,/ofXZ0Crpq4huaEqIA01IfGc6uCC.jpg,[18],en,Ithaca,6.513,Ithaca,5.3,"In a small town in California's San Joaquin Valley, 14-year-old Homer Macauley is determined to be the best and fastest bicycle telegraph messenger anyone has ever seen. His older brother has gone to war, leaving Homer to look after his widowed mother, his older sister and his 4-year-old brother, Ulysses. And so it is that as spring turns to summer, 1942, Homer Macauley delivers messages of love, hope, pain... and death... to the good people of Ithaca. And Homer Macauley will grapple with one message that will change him forever - from a boy into a man. Based on Pulitzer Prize-winning author William Saroyan's 1943 novel, The Human Comedy, ITHACA is the quintessential wartime tale of the Home Front. It is a coming-of-age story about the exuberance of youth, the sweetness of life, the sting of death and the modesty and sheer goodness that lives in each and every one of us.",2015-10-29
98,Self - Narrator,5efad50ef0317400364e6ebe,/bgkB00OM00xOQLiCwqVYMwM2JIg.jpg,720203,False,0,False,,[99],en,The Road We've Traveled,1.099,The Road We've Traveled,0.0,A short documentary on the first term of President Barack Obama's administration.,2012-03-15
99,Older Mike/Narrator (uncredited),52fe43f8c3a368484e0088bd,/pUZ2Gr9vOG4eETxzhiH9C7KQo5M.jpg,20763,False,120,False,/mgdwZ1VqL0jcGlRxfZnxu9eIj5O.jpg,[18],en,Radio Flyer,9.405,Radio Flyer,7.0,"A father reminisces about his childhood when he and his younger brother moved to a new town with their mother, her new husband and their dog, Shane. When the younger brother is subjected to physical abuse at the hands of their brutal stepfather, Mike decides to convert their toy trolley, the ""Radio Flyer"", into a plane to fly him to safety.",1992-02-21
100,Self,5f9234ea278d8a00373b5012,/6agKYU5IQFpuDyUYPu39w7UCRrJ.jpg,740985,False,117,False,/3Ysvp4ODDC6sucdQ9quHWkMiKED.jpg,[35],en,Borat Subsequent Moviefilm,110.995,Borat Subsequent Moviefilm,6.8,"14 years after making a film about his journey across the USA, Borat risks life and limb when he returns to America with his young daughter, and reveals more about the American culture, the COVID-19 pandemic, and the political elections.",2020-10-23
