,character,credit_id,poster_path,id,video,vote_count,adult,backdrop_path,genre_ids,original_language,original_title,popularity,title,vote_average,overview,release_date
101,Elliot,52fe4703c3a368484e0b053b,/90rdztFCRAxQsEfy35cxH9qt3N1.jpg,65262,False,35,False,/uwGqedgveLqykZ5L4xNZYUrWRK3.jpg,[27],en,He Knows You're Alone,5.114,He Knows You're Alone,5.3,"A reluctant bride to be is stalked by a serial killer who only kills brides and the people around them. While her friends get whacked one by one, a hard boiled renegade cop whose bride had been killed years before tries to hunt him down before it is too late. Meanwhile, the bride has to figure out if it is all in her imagination or not, aided by her ex-boyfriend...",1980-09-12
102,Himself,54a565059251414d2700ee41,/q7nBd0KGa9efwk5EpcCvQgWcT7r.jpg,315085,False,3,False,,"[10402, 10770]",en,The Concert for Valor,5.33,The Concert for Valor,9.7,A live HBO concert honoring United States veterans in Washington DC.,2014-11-11
103,Himself,58fafc4592514163ec009438,,453422,True,4,False,,[99],en,Sully: Sully Sullenberger - The Man Behind the Miracle,1.294,Sully: Sully Sullenberger - The Man Behind the Miracle,6.3,Documentary about the life of Captain Chesley Sullenberger,2016-12-20
104,Self / Allen Bauer,5ea8bc6db7fbbd001b39b498,/tqTBRER4JqHu4mjCvPA9VEcUnFP.jpg,698229,False,0,False,,"[99, 35]",en,Making a 'Splash',1.73,Making a 'Splash',0.0,Retrospective documentary on the making of the hit comedy Splash (1984).,2004-03-30
105,Baxter,5d8a4c236c1e04000facfa3b,/jrCnvkXgEe5xH7pVg6eFK05efuZ.jpg,473544,False,1,False,,[27],en,Vault of Horror I,0.653,Vault of Horror I,4.0,"A compilation of three episodes from the Tales from the Crypt series (""Carrion Death"", ""None but the lonely heart"" and ""Abra Cadaver"") with some famous cast and directors.",1994-07-02
106,Himself - Filmmaker (archive footage),52fe49b19251416c910b596d,/zHNNT9gfiGsuadR6x38KYOp6ekq.jpg,87061,False,38,False,/tx3uj8GPWf5pzb0gWATJ4bokNHI.jpg,[99],fr,Le Voyage extraordinaire,5.399,The Extraordinary Voyage,7.6,"An account of the extraordinary life of film pioneer Georges Méliès (1861-1938) and the amazing story of the copy in color of his masterpiece “A Trip to the Moon” (1902), unexpectedly found in Spain and restored thanks to the heroic efforts of a group of true cinema lovers.",2011-12-08
107,Himself - Interviewee,530f11bf925141736c0007c7,/rRL4xf3Z6kgLUyb5vbGKErlzP4h.jpg,253639,False,36,False,,"[99, 10770]",en,And the Oscar Goes To...,9.638,And the Oscar Goes To...,7.1,"The story of the gold-plated statuette that became the film industry's most coveted prize, AND THE OSCAR GOES TO... traces the history of the Academy itself, which began in 1927 when Louis B. Mayer, then head of MGM, led other prominent members of the industry in forming this professional honorary organization. Two years later the Academy began bestowing awards, which were nicknamed ""Oscar,"" and quickly came to represent the pinnacle of cinematic achievement.",2014-02-02
108,Himself,554f734e92514162f2001889,/omnB5pI8uoExdIAhiOb5Awd1wym.jpg,32562,False,58,False,,"[99, 36]",en,The Celluloid Closet,6.614,The Celluloid Closet,7.4,"This documentary highlights the historical contexts that gay, lesbian, bisexual and transgender individuals have occupied in cinema history, and shows the evolution of the entertainment industry's role in shaping perceptions of LGBT figures. The issues addressed include secrecy – which initially defined homosexuality – as well as the demonization of the homosexual community with the advent of AIDS, and finally the shift toward acceptance and positivity in the modern era.",1996-01-30
109,Narrator,5c38ad42c3a368266a5d7f9d,/8TcXwhS8HbXLXC1hadEvesf8wwb.jpg,574379,False,0,False,/6NXM452S865MhGx3WiNIYyc2bLa.jpg,"[99, 10752]",en,Beyond All Boundaries,2.556,Beyond All Boundaries,0.0,"A visual, 4-D experience of the battles of World War II featuring stories, archival footage and advanced special effects.",2009-11-09
110,Himself (voice),52fe4211c3a36847f8001551,/dYFUMhAbZ2SO9FgCJxiRn88Cw8S.jpg,35,False,5767,False,/pmwImNPFtRlXAkovmJ2MCX6f7KY.jpg,"[16, 35, 10751]",en,The Simpsons Movie,58.581,The Simpsons Movie,7.0,"After Homer accidentally pollutes the town's water supply, Springfield is encased in a gigantic dome by the EPA and the Simpsons are declared fugitives.",2007-07-26
111,Himself,58ff12c2c3a368539f00601f,/m7HxQu1CC82mYCTiabOdOja91Iw.jpg,454330,True,3,False,,[],en,Saturday Night Live: 15th Anniversary,1.948,Saturday Night Live: 15th Anniversary,8.0,"A TV special celebrating the 15th anniversary of Saturday Night Live. Before a celebrity audience, many of the former cast members and guest hosts return to perform their signature monologues and present a look back at some of the best comedy skits and musical numbers of the past 15 years.",1989-09-24
112,Self,5ec3007c4e52ed002038a723,,705899,False,0,False,,[10402],en,We Are One: The Obama Inaugural Celebration at the Lincoln Memorial,3.601,We Are One: The Obama Inaugural Celebration at the Lincoln Memorial,0.0,"A public celebration of the then forthcoming inauguration of Barack Obama as the 44th President of the United States at the Lincoln Memorial and the National Mall in Washington, D.C., on January 18, 2009. By some estimates the attendance was over 400,000.",2009-01-18
113,Himself,544a2c5a0e0a267480003bb5,,298859,True,2,False,,[99],en,All In,3.527,All In,5.3,"A behind-the-scenes look at the team and event that made history.  The DVD chronicles the Rider's incredible run to the 101st Grey Cup Championship game and their historic victory on home soil.  This 70 minute feature takes you behind the scenes of the Roughrider's 2013 season, the Grey Cup Championship Game, the Grey Cup Festival and the aftermath of one of the greatest moments in Roughrider history.  Insightful interviews get you up close and personal with General Manager Brendan Taman, Head Coach Corey Chamblin, broadcasters, event crews and the players that made it all happen.",2014-05-27
114,Himself,59e392f99251410b6700032c,,40196,False,6,False,,"[99, 10402]",en,America: A Tribute to Heroes,4.366,America: A Tribute to Heroes,6.0,"A benefit concert and telethon organized by George Clooney and broadcast uninterrupted and commercial-free by the four major television networks just 10 days after the September 11, 2001 attacks on the World Trade Center and The Pentagon to raise money for the victims and their families,",2001-09-21
115,Woody Car (voice),550da08dc3a368487d006282,/qa6HCwP4Z15l3hpsASz3auugEW6.jpg,920,False,9885,False,/sd4xN5xi8tKRPrJOWwNiZEile7f.jpg,"[16, 12, 35, 10751]",en,Cars,26.599,Cars,6.8,"Lightning McQueen, a hotshot rookie race car driven to succeed, discovers that life is about the journey, not the finish line, when he finds himself unexpectedly detoured in the sleepy Route 66 town of Radiator Springs. On route across the country to the big Piston Cup Championship in California to compete against two seasoned pros, McQueen gets to know the town's offbeat characters.",2006-06-08
116,,59e392f79251410b670002c4,/maUbhufh8qw44vg2rYnQcozpd2l.jpg,32694,False,4,False,,"[35, 99]",en,The Rutles 2: Can't Buy Me Lunch,3.618,The Rutles 2: Can't Buy Me Lunch,7.4,"Twenty-three years after the release of the original Beatles mockumentary, 'The Rutles: All You Need Is Cash', famous artists, actors and musicians speak out on how The Rutles influenced them.",2002-01-01
117,Himself (archive footage),5dd3b664356a715875e9eed6,/3RttUhiOHu1qFkmvYPdJOo1PJk5.jpg,558912,False,5,False,,[99],en,Beyond Boundaries: The Harvey Weinstein Scandal,4.359,Beyond Boundaries: The Harvey Weinstein Scandal,6.2,"Examine the rise and fall of Hollywood media mogul Harvey Weinstein following the scandal in 2017. Learn from exclusive interviews with those who knew him in the industry, and a discussion of the start of the #MeToo movement.",2018-08-21
118,Self (archive footage) (uncredited),5f5aa8efec0c580038a462e8,/PbyRPCseO3avaqj9YaxmGnHNvH.jpg,1165,False,804,False,/7HmIVY3drZ3KSugRcyazn1Wf3U9.jpg,[18],en,The Queen,14.427,The Queen,7.0,"The Queen is an intimate behind the scenes glimpse at the interaction between HM Elizabeth II and Prime Minister Tony Blair during their struggle, following the death of Diana, to reach a compromise between what was a private tragedy for the Royal family and the public's demand for an overt display of mourning.",2006-09-15
119,Himself - Host,5cb28f639251411ed620788c,/yvVW8X56vjGWEP7zLJyLWK19mk8.jpg,31107,True,12,False,/q1VtWiZlmI6bYmgpH8iomBIWd9w.jpg,[10402],en,The 25th Anniversary Rock and Roll Hall of Fame Concerts,6.199,The 25th Anniversary Rock and Roll Hall of Fame Concerts,8.3,"Featuring performances from two groundbreaking concerts held at the Madison Square Garden to celebrate a quarter century of the Rock and Roll Hall of Fame. The special is anchored by iconic musicians that include Jeff Beck Band, Crosby, Stills & Nash, Aretha Franklin, Metallica, Paul Simon, Simon & Garfunkel, Bruce Springsteen & the E Street Band, U2 and Stevie Wonder, among others.",2009-11-29
120,(voice),5f7cd9a48741c40038821fe3,/6eehp9I54syN3x753XMqjKz8M3F.jpg,1858,False,7961,False,/77P56ZcL8M9Cw7FIptMIGjhNJoj.jpg,"[28, 12, 878]",en,Transformers,8.171,Transformers,6.7,"Young teenager, Sam Witwicky becomes involved in the ancient struggle between two extraterrestrial factions of transforming robots – the heroic Autobots and the evil Decepticons. Sam holds the clue to unimaginable power and the Decepticons will stop at nothing to retrieve it.",2007-06-27
